{
  "schema_version": "1.0",
  "packet_id": "REVIEW-CALC-SYNTHETIC-WAGE",
  "packet_type": "CALCULATOR_REVIEW",
  "packet_status": "DRAFT_FOR_CROSS_VALIDATION",
  "jurisdiction": {
    "country": "CN",
    "province": "Beijing"
  },
  "generated_at": "2026-07-15T00:00:00Z",
  "snapshot_canonicalization": "RFC8785",
  "review_subject_sha256": "4089a4df9d4d45e073612be9ba2bcfec36a97ffbc2108b236bd01ce77278a5b5",
  "packet_snapshot_sha256": "d89cd82c2fa5d6cc7c5787d2bd9de994c2b11e9fb61d242a300db67f015a2ec1",
  "source_artifacts": [
    {
      "source_id": "SRC-SYNTHETIC-LAW",
      "canonical_url": "https://flk.npc.gov.cn/detail?id=synthetic-review-fixture",
      "publisher": "Synthetic official-source fixture",
      "publisher_code": "NATIONAL_LAWS_REGULATIONS_DATABASE",
      "document_title": "Synthetic wage rule for contract tests",
      "document_number": "SYNTHETIC-2026-001",
      "document_type": "LAW",
      "legal_hierarchy": "LAW",
      "binding_status": "BINDING",
      "jurisdiction": {
        "country": "CN",
        "province": "Beijing"
      },
      "retrieved_at": "2026-07-15T00:00:00Z",
      "content_sha256": "3333333333333333333333333333333333333333333333333333333333333333",
      "content_hash_status": "DECLARED_UNVERIFIED"
    }
  ],
  "subject": {
    "calculator_id": "CALC-SYNTHETIC-WAGE",
    "name": "Synthetic wage difference calculator candidate",
    "formula_id": "FORMULA-SYNTHETIC-WAGE-DIFFERENCE",
    "calculator_version": "0.0.1",
    "status": "FORMULA_CANDIDATE_UNVERIFIED",
    "result_status": "NO_LEGAL_AMOUNT_PRODUCED",
    "rule_ids": [
      "RULE-SYNTHETIC-WAGE"
    ],
    "rule_dependencies": [
      {
        "rule_id": "RULE-SYNTHETIC-WAGE",
        "review_packet_id": "REVIEW-RULE-SYNTHETIC-WAGE",
        "review_subject_sha256": "695e92736045194ced4f2e7104694ac06b48eb264155e711d5ba1ac3e8fc6466",
        "packet_snapshot_sha256": "97da7a638ce11b2980ecee2944bc89c45da105e2049453091f21b4997cad9e72",
        "binding_status": "DECLARED_UNVERIFIED"
      }
    ],
    "inputs": [
      {
        "input_id": "INPUT-WAGE-DUE",
        "label": "Synthetic wage due",
        "data_type": "DECIMAL",
        "unit": "CNY",
        "evidence_required": true,
        "rule_ids": [
          "RULE-SYNTHETIC-WAGE"
        ]
      },
      {
        "input_id": "INPUT-WAGE-PAID",
        "label": "Synthetic wage already paid",
        "data_type": "DECIMAL",
        "unit": "CNY",
        "evidence_required": true,
        "rule_ids": [
          "RULE-SYNTHETIC-WAGE"
        ]
      }
    ],
    "formula_expression_candidate": "Candidate only: INPUT-WAGE-DUE minus INPUT-WAGE-PAID.",
    "rounding_policy_candidate": "Candidate only: round half up to two decimal places after the final subtraction.",
    "intermediate_step_descriptions": [
      "Confirm the evidence-linked due amount.",
      "Confirm and deduct the evidence-linked paid amount."
    ],
    "dynamic_parameters": [],
    "conflict_checks": [
      "Do not duplicate an amount already included in another synthetic wage request."
    ],
    "test_vectors": [
      {
        "vector_id": "VECTOR-SYNTHETIC-WAGE-001",
        "inputs": {
          "INPUT-WAGE-DUE": "100.00",
          "INPUT-WAGE-PAID": "20.00"
        },
        "expected_result_candidate": "80.00",
        "review_status": "UNVERIFIED"
      }
    ]
  },
  "review_questions": [
    {
      "question_id": "Q-CALC-FORMULA",
      "prompt": "Is the formula candidate legally and arithmetically complete for the declared scope?",
      "blocking": true,
      "subject_paths": [
        "$.subject.formula_expression_candidate",
        "$.subject.inputs"
      ]
    },
    {
      "question_id": "Q-CALC-ROUNDING",
      "prompt": "Is the candidate rounding policy supported and applied at the correct step?",
      "blocking": true,
      "subject_paths": [
        "$.subject.rounding_policy_candidate"
      ]
    }
  ],
  "cross_validation": [],
  "limitations": [
    "NO_LEGAL_CORRECTNESS_VERIFIED",
    "NO_REVIEWER_IDENTITY_AUTHENTICATED",
    "NO_SUBMISSION_APPROVAL_GRANTED"
  ]
}
